Name,Action,Industry,Country,Grade
Lenovo,reported to suspend operations in Russia,Information Technology,Hong Kong,D
Loulis Mills,search for alternative suppliers,Consumer Staples,Greece,D
Maire Tecnimonet,suspended commercial activities; managing existing backlog,Industrials,Italy,D
Manitowoc,"stopped taking new orders, still maintaining office in Russia",Industrials,United States,D
Marel,paused new projects,Consumer Staples,Iceland,D
Mars,Factories and sales operating in Russia,Consumer Staples,United States,D
Mavenir,continue operating in Russia but very limited curtailment of some activities,Information Technology,United States,D
Medtronic,Limited some activities,Health Care,United States,D
Melamin,making up for shortfall from sanctions,Materials,Slovenia,D
Menarini Group,stop advertisement and new investments; continue operating plant in Russia,Health Care,Italy,D
Merck Group,no further investments/clinical trial enrollment,Health Care,United States,D
Merck KGaA,still operating and actively hiring in Russia; restrict transactions,Health Care,Germany,D
Metro,stop all growth investments and reduce advertisements,Consumer Staples,Germany,D
Mocapor,paused exports,Industrials,Portugal,D
Mohawk Industries,suspend new investments in Russia,Consumer Discretionary,United States,D
Mondelez - Nabisco,scaling back unspecified non-essential activities in Russia,Consumer Staples,United States,D
National Oilwell Varco,suspend all new investments in Russia,Energy,United States,D
Nature's Sunshine,suspend shipments into Russia but not sales,Consumer Staples,United States,D
Naust Marine,stopped projects in Russia,Industrials,Iceland,D
Nestle,"halted non-essential imports/exports to Russia, stopped all advertising, and suspended all capital investment",Consumer Staples,Switzerland,D
Nippon Steel,searching to replace Russian supplies,Materials,Japan,D
Nor-Maali,stop further investments,Industrials,Finland,D
Novartis,"pause all new capital investments, media advertising and other promotions; pause new clinical trials and enrollment of new patients",Health Care,Switzerland,D
Novo Nordisk,suspend further marketing and clinical investment; pause new clinical trials and active enrollment,Health Care,Denmark,D
NTPC,Difficulty in transacting with Russian counterparties due to SWIFT issues etc,Utilities,India,D
OMV,no new Russian investments; doing strategic review of current Russian gas investments,Energy,Austria,D
Orion,suspend investments in Russia,Health Care,Finland,D
Palfinger,reduced production,Industrials,Austria,D
Pfizer,stopped new investments/clinical trials in Russia,Health Care,United States,D
Philips,online sales still available in Russia but suspend new marketing,Consumer Discretionary,Netherlands,D
Polpharma,stop all new investments and limit deliveries to essential drugs only,Health Care,Poland,D
Pottinger,limited deliveries to Russia sales subsidiary,Industrials,Austria,D
Procter & Gamble (P&G),"Still operating, despite statement",Consumer Staples,United States,D
Red Bull,suspend new investments,Consumer Staples,Austria,D
Remondis,still operating in Russia; not disclosed publicly,Industrials,Germany,D
RHI Magnesita,selling down existing stocks in Russia,Industrials,Austria,D
Ritter Sport,halt new investments and advertising,Consumer Staples,Germany,D
Roche,pause new site activation and patient enrollment; continue operating,Health Care,Switzerland,D
Rockwool,cancel new investments in Russia,Industrials,Denmark,D
Saipem,halt new investments,Industrials,Italy,D
Sanofi,"halting advertising and promotional spending and new recruitment of patients clinical trials, continue medical supply and treating current patients",Health Care,France,D
Sarens,new projects cancelled,Industrials,Belgium,D
SC Johnson,stopped new investments and scaled back unspecified operations,Consumer Staples,United States,D
Schlumberger,stopped new investment and technology deployment to our Russia operations,Energy,United States,D
Schmitz Cargobull,Stopped all investments,Industrials,Germany,D
SCHOTT,suspend investments in Russia,Materials,Germany,D
SGS,Suspended business development and investment activities,Industrials,Switzerland,D
Signify,suspend only exports to Russia and investments and new business,Consumer Discretionary,Netherlands,D
Smith & Nephew PLC,Stopped new investments,Health Care,United Kingdom,D
Snap,halt advertisement,Communication Services,United States,D
Soudal,cancel investments in a brand new factory in Russia; but maintain other activities,Materials,Belgium,D
SRV,outline steps to stop procurement of building materials from Russia,Materials,Finland,D
Standard Chartered,Restricts Russian transactions,Financials,United Kingdom,D
Subway,suspend new investments/advertising,Consumer Staples,United States,D
Sumitomo Mitsui Financial,continue operations with local staff,Financials,Japan,D
Syneos Health,Patient recruitment on hold and no new clinical trial in Russia,Health Care,United States,D
Takeda,"Suspended new investments, advertising and promotion & no new clinical trials and stopped enrollment of new Russian patients in ongoing clinical trials.",Health Care,Japan,D
TMF Group,suspend new contracts; continue supporting current customers,Industrials,Netherlands,D
TOM Tailor,no official statement; online sales suspended but advertising continues,Consumer Discretionary,Germany,D
Toshiba Group,stop all new investments in Russia,Information Technology,Japan,D
Toshulin,Stopped cooperation,Industrials,Czech Republic,D
Total Energies,no longer will provide capital for new projects in Russia/stop purchasing Russian oil; withdraw from Arctic LNG 2 project,Energy,France,D
Toyota Tsusho,Stopped exports and imports of auto parts to and from Russia,Materials,Japan,D
TZMO,stopped new investments,Consumer Staples,Poland,D
UCB,Stopped enrolling new patients and not starting new sites or clinical trials in Russia,Health Care,Belgium,D
Unilever,stopped imports/exports and stopped all advertising and investments,Consumer Staples,United Kingdom,D
UnionPay,Suspended issuing bank cards to Russian Banks,Financials,China,D
Viatris,Suspended some operations,Health Care,United States,D
Vimeo,not accept new customers from Russia,Communication Services,United States,D
Weatherford International,suspend new investments/deployments in Russia,Energy,United States,D
Welltec,suspend all new investments in Russia,Energy,Denmark,D
Xiaomi,Reported to suspend operations in Russia,Information Technology,China,D
Yokogawa,No new projects in Russia,Information Technology,Japan,D
Yokohama,Decision to renew production in Russia despite previous announcements to halt production,Consumer Discretionary,Japan,D
Young Living,Suspend new investments in Russia,Consumer Staples,United States,D
Yves Rocher,Suspend new investments/development,Consumer Staples,France,D
Activision Blizzard,suspend new sales of and in our games in Russia,Communication Services,United States,C
Adobe,suspend all new sales in Russia and Belarus; current services continue,Information Technology,United States,C
AGCO,stop sale of new machines to Russia,Industrials,United States,C
AkzoNobel,suspend new investments in Russia; end Aerospace work,Materials,Netherlands,C
Allianz,meaningfully reduce exposure to Russia,Financials,Germany,C
Alphabet,withdraw all operations in Moscow; stop taking new customers; stop ads,Communication Services,United States,C
Amadeus IT Group,suspend partnership with Aeroflot,Information Technology,Spain,C
Amgen,suspend all non-essential business activities; keep delivering some medicines,Health Care,United States,C
ArcelorMittal,Resumed steel supplies to Russia,Materials,Luxembourg,C
ASBIS,amends contracts following new sanctions,Information Technology,Cyprus,C
Bacardi,paused exports to Russia but not domestic operations,Consumer Staples,Bermuda,C
Bank of Cyprus,maintain loan book; observe banking sanctions,Financials,Cyprus,C
Beiersdorf,maintain skin and bodycare products; stop other products,Consumer Staples,Germany,C
Bekaert,scale back business in Russia,Industrials,Belgium,C
Black Red White,"divesting from Russian subsidiary, still has a significant stake in a company operating in Belarus, which also suspended Russian exports",Consumer Discretionary,Poland,C
BNY Mellon,suspend new business activity and investments; continue cooperation with current clients,Financials,United States,C
Boehringer Ingelheim,scale back to just supplying medicine,Health Care,Germany,C
Boston Scientific,suspend all new investment and non-essential activity,Health Care,United States,C
Brenntag,suspend exports to Russia; no information about local operations,Materials,Germany,C
Bucher Industries,"not specified business activities in Russia were reduced ""substantially""",Industrials,Switzerland,C
Bureau Veritas,scaled back,Industrials,France,C
Carl Zeiss,Reduced business,Health Care,Germany,C
Carrier,not pursue new business opportunities but continue fulfilling existing contracts,Industrials,United States,C
Cersanit,"Put up its Russian business for sale, but no update on progress",Consumer Discretionary,Poland,C
CHR Hansen,suspend operations outside of staple food products,Materials,Denmark,C
Citadele Bank,still allows transactions to Russia but introduced more thorough checks,Financials,Latvia,C
Coca-Cola,suspend certain operations in Russia but continue to operate some chains (Costa Coffee),Consumer Staples,United States,C
Coinbase,block certain illicit Russian accounts but not all,Financials,United States,C
Confor Step,Stopped producing or shipping to Russia,Consumer Discretionary,Portugal,C
Continental,resumed local production after having previously suspended Russian factory,Consumer Discretionary,Germany,C
Corning,suspend almost all sales in Russia except minor life-saving products,Information Technology,United States,C
Credit Suisse,stop new business in Russia while meaningfully cutting exposure by 56%,Financials,Switzerland,C
DB Schenker,suspend direct shipments to Russia; continue Europe to Kazakhstan and Russia to Kazakhstan routes,Industrials,Germany,C
Deere,suspend shipments into Russia only,Industrials,United States,C
Dentons,Still working with separate entity,Industrials,Switzerland,C
Discord,suspend renewal of paid and premium products and services for Russian clients; free services still available,Communication Services,United States,C
Dover Corporation,ramping down sales activity and focusing on liquidating working capital,Industrials,United States,C
Dow,Suspended all purchases of feedstocks and energy and significantly reduced operations,Materials,United States,C
Duolingo,make services free and stop gaining revenue,Information Technology,United States,C
E.ON,stop buying new Russian gas,Utilities,Germany,C
Eaton,stop shipments to Russia; maintains services,Industrials,United States,C
Eimskip,reduced operation in Russia,Industrials,Iceland,C
Elanco,scale back to critical products to ensure food security,Health Care,United States,C
Epic Games,stop in-game commerce for Russia,Consumer Discretionary,United States,C
ESAB,Transition out of operations in Russia,Industrials,Sweden,C
Eutelsat,Ended involvement in the broadcast of three channels,Communication Services,France,C
Ferrero,suspend non-essential business activity,Consumer Staples,Italy,C
Fieldfisher,terminate certain Russian relationships,Industrials,United Kingdom,C
FIGMA,continue current business & stop all new sales efforts in Russia,Information Technology,United States,C
Fischer Sports,Sales activities in Russia have been severely restricted and all investments stopped.,Consumer Discretionary,Austria,C
FL Smidth,Winding down all business,Industrials,Denmark,C
Fortive,suspend most operations except medical essentials,Industrials,United States,C
GEA Group,suspend new investments,Industrials,Germany,C
General Electric (GE),stopped sales in Russia and Belarus except medical equipment and support for electric power generation and transmission,Industrials,United States,C
General Mills,suspended sales of global brands in its JV,Consumer Staples,United States,C
Geodis,suspend services in Russia & reduce shipments to and from Russia significantly,Industrials,France,C
Georg Fischer,temporary suspension of deliveries to Russia,Industrials,Switzerland,C
Glencore,Suspend only new contracts f commodities of Russian origin,Materials,Switzerland,C
Goldman Sachs,wind down business in Russia but buy Russian debt,Financials,United States,C
Groupe BPCE,suspend many transactions and cease new financing,Financials,France,C
Hellenic Bottling Company,vaguely suspend some operations in Russia,Consumer Staples,Greece,C
HILTI,limiting sales and workforce in Russia,Industrials,Liechtenstein,C
Hostinger,stop accepting payments for new purchases and renewals,Information Technology,Lithuania,C
Idemitsu Kosan,stop coal imports; lubricants business unchanged,Energy,Japan,C
Indesit,"suspend production due to ""full warehouses""",Consumer Discretionary,Italy,C
Ingersoll Rand,scale back to only health critical services,Industrials,United States,C
Ingka,"stop all exports, IKEA production; keep open retail centers (Mega)",Consumer Discretionary,Netherlands,C
"Inspire Brands (Dunkin' Donuts, Baskin Robins)",halt corporate support for franchisees,Consumer Discretionary,United States,C
Intertrust,Not accepting new Russian clients & started process of exiting all Russian Clients,Financials,Netherlands,C
IPG Photonics,suspend new investments and reduce manufacturing in Russia,Information Technology,United States,C
Iskratel,paused some business with Russia,Communication Services,Slovenia,C
J&T Finance Group,curb its activities in Russia,Financials,Slovakia,C
JPMorgan,wind down business in Russia but buy Russian debt,Financials,United States,C
Julius Baer,"wind down Russian office, suspend new business in Russia, reduce current exposure; retain current Russian clients",Financials,Switzerland,C
Kellogg,suspend new investments except essentials (minor),Consumer Staples,United States,C
Keywords Studios,Cut back business in Russia and relocated staff,Consumer Discretionary,Ireland,C
Knight Frank,scaling back substantive operations in Russia,Real Estate,United Kingdom,C
Kotak Mahindra,Paused transaction through cards in Russia,Financials,India,C
Kuehne + Nagel AG,"suspend all shipments to Russia (except Pharma, healthcare and humanitarian supplies)",Industrials,Switzerland,C
Legal & General,reduce exposure,Financials,United Kingdom,C
Linde,divest certain industrial assets and suspend new development/investments,Materials,Germany,C
Lotos,stopped purchasing Russian spot oil,Energy,Poland,C
Loyalty Ventures,scale back most services and stop new sales,Consumer Discretionary,United States,C
Luxottica,restrict Russian operations to medical services,Consumer Discretionary,Italy,C
Mahle,halt new business & scale back shipments to Russia significantly,Industrials,Germany,C
Marubeni,scaling down but still in numerous projects across Russia,Industrials,Japan,C
Maruti Suzuki,Suspend car exports,Consumer Discretionary,Japan,C
Mashreqbank,halt loans to Russia,Financials,United Arab Emirates,C
Microsoft,suspend new sales in Russia but continue existing access,Information Technology,United States,C
Miele,suspend operations except exempt healthcare,Consumer Discretionary,Germany,C
Milliken & Co,still operating in Russia,Materials,United States,C
Miro,close office in Moscow & pause new sales,Information Technology,Netherlands,C
Mitsubishi UFJ Financial Group,Japanese expats working for MUFG Bank (Eurasia) have moved out of Russia to work outside of the country on a temporary basis,Financials,Japan,C
MOL Group | MOL Plc.,Suspended activities in Russia,Energy,Hungary,C
Moody's,suspend commercial operations within Russia,Financials,United States,C
Nalco Water (Ecolab),suspended services except services critical to health,Industrials,United States,C
Natura,suspend some subsidiary operations but not all,Consumer Staples,United States,C
Nemetschek Group,suspend any new business in Russia & all business with sanctioned entities,Information Technology,Germany,C
NielsenIQ,suspend consulting service but not core business,Industrials,United States,C
Nordea Bank,stop processing payments to and from Russia & Belarus,Financials,Finland,C
Norsk Hydro,"reduced deliveries and supplies to the contractual minimum for some commitments, and is suspending deliveries and supply in several contracts",Materials,Norway,C
nVent,Suspended new business in Russia,Industrials,United Kingdom,C
Okta,halt new sales to Russia but continue supporting current customers,Information Technology,United States,C
Oriflame Cosmetics,suspend online sales to end consumers but not others,Consumer Staples,Switzerland,C
OTP Bank,wind down corporate lending,Financials,Hungary,C
Paccar,stop direct sales in Russia but continue selling through third-parties,Industrials,United States,C
Paul Wurth,"stopped new business, closed sites, and scaled back services",Industrials,Luxembourg,C
PepsiCo,suspend operations in Russia except essentials,Consumer Staples,United States,C
Phibro Animal Health Corp,curtail some operations (i.e. ethanol) and substantial sales hit,Health Care,United States,C
Philip Morris,"explore strategic alternatives, while stop new investments including $150MM, paused marketing, canceled product launches",Consumer Staples,United States,C
Pirelli,suspend new investments in Russia and scale back production,Consumer Discretionary,Italy,C
PKN Orlen SA,"stopped maritime oil shipments, diversifying supply",Energy,Poland,C
PPG,scale back majority of operations and suspend new investments in Russia,Materials,United States,C
Rosenbauer,no new business; continue servicing fire engine pumps in Russian JV,Industrials,Austria,C
Royal DSM,stopped all operations in Russia other than basic food/feed/essential health activities,Materials,Netherlands,C
Sabre,suspend certain partnerships with Aeroflot,Information Technology,United States,C
Saint-Gobain,suspend exports and imports but not local operations,Industrials,France,C
SAP,stop all sales to Russia and shut down cloud operations but some carveouts,Information Technology,Germany,C
Schaeffler,stop deliveries to Russia; continue manufacturing in Russia,Industrials,Germany,C
Scopely,suspend marketing and commerce,Communication Services,United States,C
Shutterstock,not accept new contributors from Russia; continue current businesses & still offer services to Russia,Communication Services,United States,C
SHV,"suspend new investments, new projects, new exports; continue to work with  suppliers and customers in Russia",Energy,Netherlands,C
Signet Jewelers,suspend business interaction with Russian-owned entities; no information about other Russian customers,Consumer Discretionary,United States,C
Sika,significantly scale back business in Russia; stop production; stop investments,Industrials,Switzerland,C
Sinopec,suspend $500MM new investment and significant operations and partnerships,Energy,China,C
Skadden,suspend certain operations in Russia but not all,Industrials,United States,C
Skandinaviska Enskilda Banken,scaling down operations in Russia,Financials,Sweden,C
Sketchers,suspended shipments to Russia but online sales continue,Consumer Discretionary,United States,C
Skoda,Halted production and stopped exports. Dealers continue to sell cars.,Consumer Discretionary,Czech Republic,C
Tennant,substantially suspending sales to Russia,Industrials,United States,C
Terex Corporation,stop accepting new orders from continuing dealer network in Russia,Industrials,United States,C
ThyssenKrupp,Stopped new business and investments. Closed plant,Materials,Germany,C
Tikkurila,reduce Russian operations; stop sales to aerospace; consider exiting Russia,Materials,Finland,C
Tokio Marine,suspend new contracts and repatriate employees,Financials,Japan,C
TomTom,"turn off live traffic for Russia, cut ties with several Russian customers, some customers are still under review",Information Technology,Netherlands,C
Trafigura,freeze investments and stop purchasing crude oil from Rosneft; maintain shareholding in Russia,Energy,Singapore,C
Triglav Group,not renewing or entering into new business,Financials,Slovenia,C
Tungsram,stopped producing products and projects,Utilities,Hungary,C
U.S. Polo Assn.,stopped all shipments of goods into Russia and shut down all branded digital operations but phased approach to closing physical stores,Consumer Discretionary,United States,C
UBS,suspend new business in Russia and reduce current exposure by helping clients unwind Russia securities; reducing Russian client services,Financials,Switzerland,C
Uniper SE,suspend new Russian gas purchases/divest Unipro,Utilities,Germany,C
Valentino,suspend online sales; no information about on-site sales,Consumer Discretionary,Italy,C
Westinghouse Air Brake Technologies Corp,stopped sales to Russia,Industrials,United States,C
Whirlpool,limiting production in Russia,Consumer Discretionary,United States,C
Wilo,Stop shipments to and from Russia; no comment about production in Russia,Industrials,Germany,C
Wolters Kluwer,Scale back to just health products in Russia,Financials,Netherlands,C
Yum Brands,Suspend operations of company-owned restaurants and new investments in Russia,Consumer Discretionary,United States,C
ZF Friedrichshafen,stop all deliveries to Russia; maintain JVs,Consumer Discretionary,Germany,C
Zoetis,suspend investments & focus on supply of medicines and vaccines,Health Care,United States,C
Japan Credit Bureau (JCB),suspend operations in Russia,Financials,Japan,B
3M,suspend operations in Russia,Industrials,United States,B
Abrdn,suspend investments in Russia and reduce exposure,Financials,United Kingdom,B
ACCA,suspend operations in Russia and Belarus,Industrials,United Kingdom,B
Acer,suspend its business in Russia,Information Technology,Taiwan,B
Acne Studios,put all Russian activities on hold,Consumer Discretionary,Sweden,B
Adamed,halt sales and production in Russia,Health Care,Poland,B
ADEO | Leroy Merlin,Will transfer control of Leroy Merlin,Consumer Discretionary,France,B
ADP,suspend sales/services to Russia,Information Technology,United States,B
AICPA,suspend sale and delivery of services indefinitely,Industrials,United States,B
Air Astana,suspend flights to Russia,Industrials,Kazakhstan,B
Air France,halt flight to and from Russia,Industrials,France,B
Air Malta,suspend all flights to and from Russia,Industrials,Malta,B
Airbnb,block bookings and block accepting guests in Russia,Consumer Discretionary,United States,B
Akamai,suspend sales in Russia,Information Technology,United States,B
Akin Gump,suspend operations in Russia,Industrials,United States,B
AL-KO Vehicle Technology,suspend deliveries to Russia and Belarus,Consumer Discretionary,Germany,B
Alaska Airlines,temporarily suspend partnership with Russian airline,Industrials,United States,B
Alimentation Couche-Tard,suspend operations,Consumer Staples,Canada,B
Alstom,suspend shipments to Russia,Industrials,France,B
AM Best,suspend all commercial activities to Russian clients,Information Technology,United States,B
Amazon,suspend operations in Russia,Consumer Discretionary,United States,B
Ambarella,suspend shipments into Russia,Information Technology,United States,B
AMD,suspend all sales to Russia,Information Technology,United States,B
Amdocs,stop all new sales of product and services in Russia,Information Technology,United States,B
Amer Sports,Intention to discontinue business in Russia,Consumer Discretionary,Finland,B
American Express,suspend operations in Russia,Financials,United States,B
Amica,suspended Russian exports,Consumer Discretionary,Poland,B
Analog Devices,suspend sales to Russia according to sanctions,Information Technology,United States,B
Ansys,suspend all sales and business activity,Information Technology,United States,B
Aon PLC,suspend operations in Russia,Financials,United Kingdom,B
Apple,suspend all official site sales; turn off select apps and services,Information Technology,United States,B
Arla,suspends all operations,Consumer Staples,Denmark,B
ARM,suspend shipments according to sanctions,Information Technology,United Kingdom,B
Asian Infrastructure Investment Bank,curtail Russian access to capital markets,Financials,China,B
Asos,suspend all shipments to Russia,Consumer Discretionary,United Kingdom,B
Association of International Certified Professional Accountants,indefinite suspension of services within Russia,Industrials,United States,B
Aston Martin,suspend all shipments to Russia,Consumer Discretionary,United Kingdom,B
Asus,suspend shipments to Russia,Information Technology,Taiwan,B
Atlas Copco,suspend deliveries in Russia,Industrials,Sweden,B
Atlassian,Suspended software sales to Russia,Information Technology,Australia,B
Audi,suspend operations at Kaluga assembly plant,Consumer Discretionary,Germany,B
Australia Post,Suspend all business with Russia,Communication Services,Australia,B
Austrian Airlines,Cancel Russian flights until July,Industrials,Austria,B
Authentic Brands Group - Reebok,successfully completed suspension of all operations,Consumer Discretionary,United States,B
Autodesk,suspend operations in Russia,Information Technology,United States,B
Avast,suspend all operations in Russia,Information Technology,Czech Republic,B
AXA,stop underwriting new insurance & stop renewals,Financials,France,B
AXA Investments Managers,pause investments & prohibit new subscriptions,Financials,France,B
Axis Communication,Suspend all product shipments to Russia,Consumer Discretionary,Sweden,B
Azerbaijan Airlines,suspend flights to Russia,Industrials,Azerbaijan,B
B Lab,suspend Russian companies from obtaining certifications,NGO,United States,B
Badminton World Federation,cancel all tournaments,NGO,Malaysia,B
Bain,suspend consulting for all Russian businesses,Industrials,United States,B
Bang & Olufsen,suspended deliveries and sales to Russia,Information Technology,Denmark,B
Bank of China,curtail Russian access to capital markets,Financials,China,B
