Name,Action,Industry,Country,Grade
BCG,suspend operations; Moscow office open,Industrials,United States,B
Bentley,suspend all shipments to Russia,Consumer Discretionary,United States,B
Big Fish Games,suspend downloadable game business in Russia,Communication Services,United States,B
Bitdefender,suspend all sales to Russia,Information Technology,Romania,B
BlackBerry,cease all activities in Russia,Information Technology,Canada,B
BMC,suspend all business with Russia & Belarus,Information Technology,United States,B
BMW,suspend exports to and production in Russia,Consumer Discretionary,Germany,B
BNP Paribas,suspend new business in Russia/curtail financing,Financials,France,B
Boeing,suspend operations in Russia/titanium purchases,Industrials,United States,B
Bombardier,restrict Russian business,Industrials,Canada,B
Boohoo Group,suspend all shipments to Russia,Consumer Discretionary,United Kingdom,B
Boosteroid Cloud Gaming,suspend services to Russia,Information Technology,United Arab Emirates,B
Boryszew,suspended operations in Russia,Materials,Poland,B
Brav,suspend sales and operations in Russia,Consumer Discretionary,Norway,B
Bridgestone Tire,suspend manufacturing in Russia and shipments into,Consumer Discretionary,Japan,B
Brinks,Suspended business in Russia,Consumer Discretionary,United States,B
British Airways,cancel Russian flights,Industrials,United Kingdom,B
Brown-Forman,suspend commercial operations in Russia,Consumer Staples,United States,B
Brunico Communications,Put all business with Russia on hold,Communication Services,Canada,B
BUDVAR Centrum Sp. z.o.o.,Suspended Activity,Industrials,Poland,B
Budweiser Budvar,suspends production and supply of beer,Consumer Staples,Czech Republic,B
Bulgaria Air,suspend flights to Russia,Industrials,Bulgaria,B
Bulgarian Postbank,stop operations in Russian ruble,Financials,Bulgaria,B
bunq.com,suspend SWIFT transfers to sanctioned banks,Financials,Netherlands,B
Burberry,suspend all shipments to Russia,Consumer Discretionary,United Kingdom,B
Burger King (Restaurant Brands),halt corporate support for franchises,Consumer Staples,United States,B
Buta Airways,suspend flights to Russia,Industrials,Azerbaijan,B
Callaway Golf,Suspended business in Russia,Consumer Discretionary,United States,B
Canada Goose,suspend all shipments to Russia,Consumer Discretionary,Canada,B
Canadian Tire,close Russia stores,Consumer Discretionary,Canada,B
Canon,suspend deliveries in Russia,Information Technology,Japan,B
Canonical,suspend support & professional services,Information Technology,United Kingdom,B
Capgemini,stop services to Russia,Information Technology,France,B
Cargolux,suspend all shipments into and through Russia,Industrials,Luxembourg,B
Caterpillar,suspend all operations,Industrials,United States,B
CBRE,discontinue Russian business,Real Estate,United States,B
Ceratizit,Stop all deliveries to Russia and Belarus. Still distributes through distributors,Industrials,Luxembourg,B
Chemours,Suspended business in Russia,Materials,United States,B
Chevron,"Pausing all transactions and sales of refining products, lubricants, and chemicals",Energy,United States,B
Chipperfield,suspend operations in Russia,Industrials,United Kingdom,B
Chopard,Suspend all Russian diamond purchases,Consumer Discretionary,Switzerland,B
Cie Automotives,temporarily shut down aluminum plant,Consumer Discretionary,Spain,B
Ciena,suspend business operations in Russia,Communication Services,United States,B
Citi,Ending nearly all its institutional banking services in Russia,Financials,United States,B
Citrix,suspend all sales to Russia,Information Technology,United States,B
Cleary Gottlieb,suspend Russian operations,Industrials,United States,B
Clorox,suspend business activity in Russia,Consumer Staples,United States,B
Clutch,suspend all business activity,Industrials,United States,B
CME Group,suspend acceptance of certain Russian commodities,Financials,United States,B
CNH Industrial,suspend sales to Russia,Industrials,United Kingdom,B
Cogent Communications,cut all internet to Russia,Communication Services,United States,B
Columbia Sportswear,pause taking any new orders from Russian distributor & remove future sales,Consumer Discretionary,United States,B
Commerzbank,suspend operations in Russia,Financials,Germany,B
Conde Nast,suspend all publishing operations,Communication Services,United States,B
Conformis,suspend distribution operations in Russia,Health Care,United States,B
Costco,stopped purchases from Russia,Consumer Discretionary,United States,B
Coupa,suspend operations in Russia,Information Technology,United States,B
Coursera,platform available; refrain from financial benefits from the region; suspend some content,Consumer Discretionary,United States,B
Credit Agricole,suspend all services in Russia,Financials,France,B
Crocs,suspend D2C business,Consumer Discretionary,United States,B
Curve,no longer allow Russian payment cards & transaction in RUB,Financials,United Kingdom,B
Cyprus Airways,suspend flights to Russia,Industrials,Cyprus,B
d&b audiotechnik,suspend all shipments to Russia,Consumer Discretionary,Germany,B
DACHSER,End all transports to Russia,Industrials,Germany,B
DAF,Suspend business in Russia,Consumer Discretionary,Netherlands,B
Daimler Truck,freeze activities in Russia,Consumer Discretionary,Germany,B
Damen,"stop supplying ships to Russia, halt new contracts",Industrials,Netherlands,B
Danaher,suspended shipments to Russia except for humanitarian medical products,Health Care,United States,B
Danone,Announced Transfer,Consumer Staples,France,B
Danske Bank,suspend operations in Russia,Financials,Denmark,B
Dassault Aviation,suspend all shipments to Russia,Industrials,France,B
Dassault Systèmes,suspend business operations in Russia,Information Technology,France,B
Debevoise & Plimpton,Wind down Russia operations; local partners and counsel open Russian business,Industrials,United States,B
Decathlon,suspend the operation of its stores in Russia,Consumer Discretionary,France,B
Deckers,suspend business in Russia,Consumer Discretionary,United States,B
Demant,suspend all trade with Russia,Health Care,Denmark,B
Denso,suspend all shipments into Russia,Consumer Discretionary,Japan,B
Depositphotos,stop all sales and services to Russia,Consumer Discretionary,Ukraine,B
DHL,suspend all shipments to Russia,Industrials,Germany,B
Diadora,suspend contracts with Russian commercial partners,Consumer Discretionary,Italy,B
Diageo,suspend all shipments to Russia,Consumer Staples,United Kingdom,B
Diebold Nixdorf,suspend shipments and sales of any kind into Russia.,Information Technology,United States,B
DirecTV,cut Kremlin backed TV networks,Communication Services,United States,B
Discover,suspend efforts to establish Russian presence,Communication Services,United States,B
Discovery,Suspend Russian access,Communication Services,United States,B
Disney,pause new content releases,Communication Services,United States,B
DJI,stop selling drones in Russia,Information Technology,China,B
DKV Mobility,stop all activity for Russian domestic business,Information Technology,Germany,B
Dreamstime,restrict download plans and payments for Russian customers,Communication Services,United States,B
DSV A/S,suspend all shipments to Russia,Industrials,Denmark,B
DuPont,suspend operations in Russia and Belarus,Materials,United States,B
Dyson,Suspend business in Russia,Consumer Discretionary,Singapore,B
eBay,suspend all shipments to Russia,Consumer Discretionary,United States,B
ECFMG,Suspend Russian certifications,Industrials,United States,B
EDF,suspend Moscow office,Utilities,France,B
eDreams ODIGEO,cease all operations involving Russia,Consumer Discretionary,Spain,B
Edrington,suspend all shipments to Russia,Consumer Staples,United Kingdom,B
Egon Zehnder,stop operations in Russia,Industrials,United States,B
Electrolux,suspending all shipments into Russia,Consumer Discretionary,Sweden,B
Elsevier,Winding down all operations in Russia,Communication Services,Netherlands,B
Embraer,suspend supplying parts and services to Russia,Industrials,Brazil,B
Epiroc,pause all deliveries to Russia and no operations domestically,Consumer Staples,Sweden,B
Eppendorf SE,suspend exports to Russia; keep rep office open,Health Care,Germany,B
Epson,suspend exports to Russia & Belarus,Consumer Discretionary,Japan,B
Equinix,suspend Russian partnerships and customers,Real Estate,United States,B
Ericsson,suspend all shipments to Russia,Information Technology,Sweden,B
ESET,suspend all sales to Russia,Information Technology,Slovakia,B
Esri,Suspending all sales of products and services.,Information Technology,United Kingdom,B
Estee Lauder,suspend operations in Russia,Consumer Staples,United States,B
Etex,Suspended business in Russia,Communication Services,Belgium,B
Eurasian Resources Group,Suspend substantively all Russian commodities purchases,Materials,Luxembourg,B
European University Association,cease cooperation with governmental agencies in Russia,NGO,Belgium,B
Exiger,halting all activity and due diligence in Russia,Industrials,United States,B
Exor,holding company's assets are suspending operations,Financials,Netherlands,B
Famur,suspend Russian exports,Industrials,Poland,B
FANUC,"Totally suspend all shipments, services and maintenance in Russia",Industrials,Japan,B
Farfetch,suspend all shipments to Russia,Consumer Discretionary,United Kingdom,B
Fédération Internationale de Motocyclisme,"ban Russian, Belarusian licence holders",NGO,Switzerland,B
FedEx,suspend all shipments to Russia,Industrials,United States,B
Ferragamo,suspend all shipments to Russia,Consumer Discretionary,Italy,B
Ferrari,suspend sales in Russia,Consumer Discretionary,Italy,B
FIBA,ban Russian teams and officials from participating in basketball events,NGO,Switzerland,B
Fidelity,Suspend trading of Russian securities,Financials,United States,B
FIFA,ban Russian athletes from competing,Industrials,Switzerland,B
Finnlines,suspend all traffic to Russia,Industrials,Finland,B
Fitch,suspend operations in Russia,Financials,United States,B
Fiverr,suspend business,Consumer Discretionary,Israel,B
Forest Stewardship Council (FSC),suspend all trading certificates in Russia & Belarus and block all controlled wood sourcing from the two countries,NGO,Germany,B
Fortinet,suspend operations in Russia,Information Technology,United States,B
Foster + Partners,stop work on projects in Russia,Industrials,United Kingdom,B
Fujitsu,cease orders and shipments to Russia,Information Technology,Japan,B
Ganni,freeze all trade with Russia,Consumer Discretionary,Denmark,B
Gap Inc,stopped shipments to franchisees in Russia,Consumer Discretionary,United States,B
Gasum,Suspend all purchases from Russia,Energy,Finland,B
Generac,Suspend all business in Russia,Industrials,United States,B
Gestamp,stopped production,Consumer Discretionary,Spain,B
GetYourGuide,suspend all Russian operations,Consumer Discretionary,Switzerland,B
Goodyear,suspend shipments of tires to Russia,Consumer Discretionary,United States,B
Grainpro,suspend all operations in Russia,Materials,United States,B
Grammarly,block users located in Russia and Belarus from using products or services,Information Technology,United States,B
Graphisoft,"suspended new activities, disabled access to our commercial services in Russia",Information Technology,Hungary,B
Grupa Azoty,stopped exporting its products to Russia or Belarus,Materials,Poland,B
Grupo Antolín,suspend operations in Russia,Consumer Discretionary,Spain,B
Grupo Bimbo,"Suspended distribution of the Bimbo Brand at retail, but left Moscow Bimbo QSR plant operating for food service products",Consumer Staples,Mexico,B
Hannover Re,halt underwriting business,Financials,Germany,B
Hapag Lloyd,suspend all shipments to Russia,Industrials,Germany,B
HARIBO,suspend production to Russia,Consumer Staples,Germany,B
Harley-Davidson,suspending all business in Russia,Consumer Discretionary,United States,B
Hasbro,pause toy shipments of Russia,Consumer Discretionary,United States,B
Heraeus,stop goods and money flows to Russia,Industrials,Germany,B
Herbalife,suspend sales and shipments to Russia,Consumer Staples,United States,B
Hermes,suspend all operations in Russia,Consumer Discretionary,France,B
Herzog & de Meuron,suspend work on Russian projects,Industrials,Switzerland,B
Hexagon,freeze all business activities,Information Technology,Sweden,B
HHLA,suspend entry of Russian shipments at owned ports,Financials,Germany,B
Hindalco,suspend operations,Materials,India,B
Hitachi Construction,suspend all shipments to Russia,Industrials,Japan,B
HMM,suspend all shipments to Russia,Industrials,South Korea,B
Honda,suspend all shipments to Russia,Consumer Discretionary,Japan,B
Honey Group,suspend sales to Russia,Consumer Staples,Finland,B
Hugo Boss,temporarily close stores and e-commerce sites,Consumer Discretionary,Germany,B
Hunkemoller,suspend operations of on-site and online stores,Consumer Discretionary,Netherlands,B
Husqvarna,stop exports to Russia & halt investments,Consumer Discretionary,Sweden,B
Hyundai,suspend manufacturing in Russia,Consumer Discretionary,South Korea,B
Iberia,canceling flights to Russia,Industrials,Spain,B
ICBC,curtail Russian access to capital markets,Financials,China,B
Icecat,suspends activities for the Russian market,Industrials,Netherlands,B
iHerb,Suspend all Russian sales,Consumer Discretionary,United States,B
Illinois Tool Works,suspension of sales to Russia,Industrials,United States,B
Indeed,suspend service in Russia,Information Technology,United States,B
Institute of Internal Auditors,suspend business in Russia,Industrials,United States,B
Intel,suspend sales to Russia,Information Technology,United States,B
Interactive Advertising Bureau,suspend licensing in Russia and Belarus,Industrials,United States,B
Intercomm Foods,Stopping shipments to Russia,Consumer Staples,Greece,B
International Canoe Federation,suspend Russian athletes & relocate Russian events,NGO,Switzerland,B
International Federation of Sport Climbing,suspend Russian teams from participation; suspend Russian events,NGO,Italy,B
International Tennis Federation,suspend Russian partnerships,NGO,United Kingdom,B
Intertek,suspend operations,Industrials,United States,B
Intuit,suspend customer accounts,Information Technology,United States,B
Isuzu,Suspend business in Russia,Consumer Discretionary,Japan,B
Jablotron,halts sales and blocks data services to products assembled in  Russia,Consumer Discretionary,Czech Republic,B
JCB,pause business in Russia,Industrials,United Kingdom,B
Johnson Controls,suspend operations in Russia,Industrials,Ireland,B
Julipedra,suspended exports to Russia,Materials,Portugal,B
Jungheinrich,keep Russia office; stop exports to Russia,Industrials,Germany,B
Juniper Networks,suspend sales in Russia,Information Technology,United States,B
Kärcher,suspend exports to Russia & halt investments,Consumer Discretionary,Germany,B
KBC Group,suspend transactions with certain Russian banks,Financials,Belgium,B
Kepenou Mills,stop wheat orders from Russia,Consumer Staples,Greece,B
Kering,close all stores in Russia,Consumer Discretionary,France,B
Kerry Group,suspending operations,Consumer Staples,Ireland,B
Kesko,stop sales to Russia and imports from Russia,Consumer Staples,Finland,B
KGHM,"suspended Russian contracts, subsidiary ZANAM Vostok in Russia",Materials,Poland,B
Kingston,suspend shipments to Russia,Information Technology,United States,B
KLM,cancel flights to and from Russia,Industrials,Netherlands,B
Kodak Alaris,suspend all business activity into Russia & Belarus,Information Technology,United Kingdom,B
Komatsu,suspend all shipments to Russia,Industrials,Japan,B
KONE,suspend deliveries to Russia & stop new Russian orders,Industrials,Finland,B
Konecranes,stop all orders from Russia,Industrials,Finland,B
Konica Minolta,new shipments suspended,Consumer Discretionary,Japan,B
Körber,suspend new business with Russia,Industrials,Germany,B
Korean Air Lines,no flying over Russian airspace; Russian flights cancelled,Industrials,South Korea,B
Korn Ferry,suspend business in Russia,Industrials,United States,B
Krombacher,stopped exports to Russia,Consumer Staples,Germany,B
Kubota,cancel production of equipment orders from Russian,Industrials,Japan,B
KUKA,suspend all business with Russia,Industrials,Germany,B
Kurokesu,suspend shipments to Russia,Consumer Discretionary,Lithuania,B
Kyocera,suspend deliveries of all devices to Russia,Information Technology,Japan,B
L'Oreal,suspend operations in Russia,Consumer Discretionary,France,B
La Lorraine,halt its 50mn euro investment in Moscow,Consumer Staples,Belgium,B
Lanxess,suspend business activities with Russia,Materials,Germany,B
LCBO,suspend Russian-produced products,Consumer Staples,Canada,B
Lego,suspend all shipments to Russia,Consumer Discretionary,Denmark,B
Leica Camera AG,suspend operations in Russia,Information Technology,Germany,B
Leonardo,pause all JVs in Russia; helicopter production,Industrials,Italy,B
Les Ballets de Monte-Carlo,suspend performance rights for his ballet,Consumer Discretionary,Monaco,B
Levi Strauss,suspend all sales in Russia,Consumer Discretionary,United States,B
Lexmark,suspend shipments to Russia,Information Technology,United States,B
LG Electronics,suspend new product shipments to Russia,Information Technology,South Korea,B
Little Caesar's,suspend Russian franchise support,Consumer Discretionary,United States,B
Live Nation Entertainment,stop business with Russia,Communication Services,United States,B
Lladró,suspended service and shipment to Russia.  No new requests,Consumer Discretionary,Spain,B
Louis Dreyfus,suspend operations in Russia,Consumer Staples,Netherlands,B
Lumen,cut networks to Russia,Communication Services,United States,B
LUSH,suspend online sales & supply to Russia,Consumer Discretionary,United Kingdom,B
M&G,phased divestment of Russian assets,Financials,United Kingdom,B
Maersk,suspend all shipments to Russia,Industrials,Denmark,B
Magna,suspend Russian plants,Consumer Discretionary,Canada,B
Magna Steyr,suspend deliveries to Russia,Consumer Discretionary,Austria,B
Mango,suspend direct operations in Russia,Consumer Discretionary,Spain,B
Manolo Blahnik,suspend sales to Russia,Consumer Discretionary,United Kingdom,B
Marks & Spencer,suspend all shipments to Russia,Consumer Staples,United Kingdom,B
Marriott,suspend all Russian operations,Consumer Discretionary,United States,B
Marvell,suspend all sales to Russia in compliance with sanctions,Information Technology,United States,B
Mastercard,suspend operations in Russia,Information Technology,United States,B
Mattel,suspend shipments into Russia,Consumer Discretionary,United States,B
Mazda,suspend all shipments to Russia,Consumer Discretionary,Japan,B
McCormick,suspend operations in Russia,Consumer Staples,United States,B
Meggit,cease all imports and exports with Russia,Industrials,United Kingdom,B
Meta,suspend Russian advertising,Communication Services,United States,B
Metsa,suspend operations at Russian mill,Materials,Finland,B
Metso Outotec,suspend all shipments to Russia,Industrials,Finland,B
Mettler Toledo,suspend all shipments to Russia,Health Care,United States,B
Michelin,suspended all operations in Russia,Consumer Discretionary,France,B
Micro Focus,Suspended business in Russia,Information Technology,United Kingdom,B
Micron,Suspend shipments to Russia according to sanctions,Information Technology,United States,B
Milk Hydrosan sp. z o.o.,suspended Russian contracts,Industrials,Poland,B
Mitsubishi Electric,stop all sales to Russia but reserve the right to return,Industrials,Japan,B
Mitsubishi Motors,suspended operations at Russian plant,Consumer Discretionary,Japan,B
Mobatime (Elekon),stopped activity and remotely stopped clock on Russian Academy of Sciences,Consumer Discretionary,Czech Republic,B
Moncler,suspend operations in Russia,Consumer Discretionary,Italy,B
Moneygram,suspend all payments to Russia,Financials,United States,B
MongoDB,suspend sales to Russia and Belarus,Information Technology,United States,B
Mothercare,suspend operations in Russia,Consumer Discretionary,United Kingdom,B
Motorola Solutions,suspend service orders to Russia,Information Technology,United States,B
MS & AD Insurance Group,suspending operations,Financials,Japan,B
MSC,temporary suspension of all shipments to Russia,Financials,United States,B
MSC Cruises,suspend calls to Russia,Consumer Discretionary,Switzerland,B
Munich Re,not renew current contracts & suspend new business,Financials,Germany,B
MV Group,"suspends all imports and orders, froze partner brands",Consumer Staples,Lithuania,B
MVRDV,suspend operations in Russia,Industrials,Netherlands,B
Namecheap,stop offering products to Russia,Information Technology,United States,B
NCR,suspend sales to Russia,Information Technology,United States,B
NEC,suspend all future sales,Information Technology,Japan,B
Nemak,halt production in Russia,Consumer Discretionary,Mexico,B
Neste Oyj,suspend purchases of Russian oil,Energy,Finland,B
NetApp,suspend business operations in Russia,Information Technology,United States,B
New Balance,suspend shipments to Russia,Consumer Discretionary,United States,B
New Development Bank,curtail Russian access to capital markets,Financials,China,B
NHL,pause all partnerships in Russia,NGO,United States,B
Niantic Labs,products made unavailable in Russia,Information Technology,United States,B
Nikon,suspend shipments to Russia,Consumer Discretionary,Japan,B
Nintendo,suspend all sales in Russia,Communication Services,Japan,B
Nippon Telegraph and Telephone Corporation (NTT),"Completed sale of business, transitioning team",Communication Services,Japan,B
Norton,suspend sales to Russia,Information Technology,United States,B
Nozbe,cut off services for Russia and Belarus,Industrials,Poland,B
NSG Group (Pilkington),suspension all trading and investment,Materials,Japan,B
Nu Skin,suspend Russian operations,Consumer Staples,United States,B
Nutanix,pause all sales and support to Russia,Information Technology,United States,B
Nvidia,suspend all sales in Russia,Information Technology,United States,B
NXP Semiconductors,suspend all shipments to and business with Russia,Information Technology,Netherlands,B
Olvi,stop exports to Russia,Consumer Staples,Finland,B
Olympus,suspend sales of Scientific Solutions portfolio and all capital investments,Information Technology,Japan,B
ON24,suspend all Russian activities,Information Technology,United States,B
OP Bank Lithuania,temporarily stop the processing of all  payments from and to Russia & Belarus,Financials,Lithuania,B
OpenText,suspend all business,Information Technology,Canada,B
Oracle,suspend all operations in Russia,Information Technology,United States,B
Outokumpu,stop sales and deliveries to Russia,Materials,Finland,B
PagerDuty,suspend cooperation with Russian customers,Information Technology,United States,B
Panasonic,suspend operations in Russia,Consumer Discretionary,Japan,B
Papa John's,suspend support for all Russian franchises,Consumer Discretionary,United States,B
Par Pacific,suspend purchases of Russian crude oil,Energy,United States,B
Paramount,pause new content releases to Russia,Communication Services,United States,B
Payoneer,close Russian accounts,Information Technology,United States,B
Paypal,suspend operations in Russia,Information Technology,United States,B
Peak Design,shut down sales to Russia,Consumer Staples,United States,B
Pekao SA,transactions in Russian ruble suspended,Financials,Poland,B
Pernod Ricard,"Resumed exports to Russia, then halted after calls to boycott",Consumer Staples,France,B
Pivovary Staropramen,suspended beer exports,Consumer Staples,Czech Republic,B
Playmobil,stop all sales to Russia,Consumer Discretionary,Germany,B
Plzeňský Prazdroj,suspend sales to Russia,Consumer Staples,Czech Republic,B
Podravka,stop deliveries to Russia,Consumer Staples,Croatia,B
Polaris,suspend exports to Russia,Consumer Discretionary,United States,B
Porsche,end shipments of new cars; dealerships running and warranty obligations honored,Consumer Discretionary,Germany,B
Prada,suspend operations in Russia,Consumer Discretionary,Italy,B
Preem AB,suspend purchases of Russian oil,Energy,Sweden,B
Prosus,In process of divesting from local subsidiary,Industrials,Netherlands,B
PTC,discontinue all business operations and sales,Information Technology,United States,B
Puma,suspend all shipments to Russia,Consumer Discretionary,Germany,B
PVH,suspend operations in Russia,Consumer Discretionary,United States,B
Qlik,suspend sales and services to Russia,Information Technology,Sweden,B
QS,cease activity with Russian customers & cease promotion of Russian universities,NGO,United Kingdom,B
Qualcomm,suspend shipments to Russia,Information Technology,United States,B
Rabobank,curtail Russian access to capital markets,Financials,Netherlands,B
Radio Free Europe,suspend operations in Russia,Communication Services,Czech Republic,B
Rakovnický Pivovar,stopped exports and withdrew some products for sale in Russia,Consumer Staples,Czech Republic,B
Ralph Lauren,pause operations in Russia,Consumer Discretionary,United States,B
Raytheon,suspend operations in Russia,Industrials,United States,B
Recruit Holdings,Suspend Russian access,Industrials,Japan,B
Reima,suspend all sales into Russia,Consumer Discretionary,Finland,B
Remitly Global,stop accepting new users in Russia,Information Technology,United States,B
Renishaw,Suspended business in Russia,Industrials,United Kingdom,B
Revolut,stop top-ups for Russian cards and block transfers to Russian institutions,Financials,United Kingdom,B
Richemont,suspend all operations in Russia,Consumer Discretionary,Switzerland,B
Ricoh,suspend shipments to Russia,Information Technology,Japan,B
Roca,closure of plants,Consumer Discretionary,Spain,B
Rockwell Automation,suspend operations in Russia,Industrials,United States,B
Roland DG,suspend all exports and sales to Russia,Information Technology,Japan,B
Rolex,suspend exports to Russia,Consumer Discretionary,Switzerland,B
Rolls Royce,suspend all shipments to Russia,Industrials,United Kingdom,B
